,EDINET Code,Submitter Name,IsRecorded_try0,IsRecorded_try1,IsRecorded_try2,IsRecorded_try3,IsRecorded_try4,IsRecorded
2375,E03225,株式会社サックスバーホールディングス,1,0,0,0,0,1
2376,E03226,株式会社サンドラッグ,1,0,0,0,0,1
2377,E03227,株式会社やまや,1,0,0,0,0,1
2378,E03228,株式会社ヤマザワ,1,0,0,0,0,1
2379,E03229,株式会社ベルーナ,1,0,0,0,0,1
2380,E03230,株式会社ジョイス,0,0,0,0,0,0
2381,E03231,株式会社アトム,1,0,0,0,0,1
2382,E03232,株式会社新星堂,1,0,0,0,0,1
2383,E03233,はるやま商事株式会社,1,0,0,0,0,1
2384,E03235,株式会社ノジマ,1,0,0,0,0,1
2385,E03236,カッパ・クリエイト株式会社,1,0,0,0,0,1
2386,E03238,ＤＣＭサンワ株式会社,1,0,0,0,0,1
2387,E03240,株式会社ライトオン,1,0,0,0,0,1
2388,E03244,株式会社ジーンズメイト,1,0,0,0,0,1
2389,E03245,株式会社サンデー,1,0,0,0,0,1
2390,E03246,株式会社マツヤ,1,0,0,0,0,1
2391,E03247,株式会社キタムラ,1,0,0,0,0,1
2392,E03248,株式会社　良品計画,1,0,0,0,0,1
2393,E03249,株式会社　三城ホールディングス,1,0,0,0,0,1
2394,E03250,マックスバリュ北海道株式会社,1,0,0,0,0,1
2395,E03251,セフテック株式会社,1,0,0,0,0,1
2396,E03252,ダイヤ通商株式会社,1,0,0,0,0,1
2397,E03255,株式会社ジー・ネットワークス,0,0,0,0,0,0
2398,E03257,株式会社マルミヤストア,1,0,0,0,0,1
2399,E03258,株式会社オーエー・システム・プラザ,0,0,0,0,0,0
2400,E03259,株式会社コナカ,1,0,0,0,0,1
2401,E03264,扶桑電通株式会社,1,0,0,0,0,1
2402,E03266,株式会社　ハウス　オブ　ローゼ,1,0,0,0,0,1
2403,E03267,株式会社Ｇ‐７ホールディングス,1,0,0,0,0,1
2404,E03268,イオン北海道株式会社,1,0,0,0,0,1
2405,E03269,アイエーグループ株式会社,1,0,0,0,0,1
2406,E03270,株式会社コジマ,1,0,0,0,0,1
2407,E03271,株式会社　ヒマラヤ,1,0,0,0,0,1
2408,E03272,株式会社マルヨシセンター,1,0,0,0,0,1
2409,E03273,コーナン商事株式会社,1,0,0,0,0,1
2410,E03274,株式会社エコス,1,0,0,0,0,1
2411,E03275,ワタミ株式会社,1,0,0,0,0,1
2412,E03276,アールビバン株式会社,1,0,0,0,0,1
2413,E03278,マルシェ株式会社,1,0,0,0,0,1
2414,E03279,株式会社グリーンクロス,1,0,0,0,0,1
2415,E03280,株式会社ドンキホーテホールディングス,1,0,0,0,0,1
2416,E03281,Ａｓ－ｍｅエステール株式会社,1,0,0,0,0,1
2417,E03282,株式会社メガネトップ,0,0,0,0,0,0
2418,E03283,株式会社柿安本店,1,0,0,0,0,1
2419,E03286,株式会社スリーエフ,1,0,0,0,0,1
2420,E03287,株式会社西松屋チェーン,1,0,0,0,0,1
2421,E03289,株式会社中京医薬品,1,0,0,0,0,1
2422,E03291,株式会社ゼンショーホールディングス,1,0,0,0,0,1
2423,E03293,株式会社幸楽苑ホールディングス,1,0,0,0,0,1
2424,E03294,株式会社ハークスレイ,1,0,0,0,0,1
2425,E03295,株式会社安楽亭,1,0,0,0,0,1
2426,E03296,株式会社ワークマン,1,0,0,0,0,1
2427,E03297,株式会社ジャパンケアサービスグループ,0,0,0,0,0,0
2428,E03298,株式会社モンテカルロ,0,0,0,0,0,0
2429,E03299,株式会社ヤマノホールディングス,1,0,0,0,0,1
2430,E03301,株式会社パスポート,1,0,0,0,0,1
2431,E03302,オリジン東秀株式会社,0,0,0,0,0,0
2432,E03304,株式会社ニチリョク,1,0,0,0,0,1
2433,E03305,株式会社サイゼリヤ,1,0,0,0,0,1
2434,E03306,株式会社かんなん丸,1,0,0,0,0,1
2435,E03310,株式会社魚力,1,0,0,0,0,1
2436,E03311,株式会社　ナイスクラップ,1,0,0,0,0,1
2437,E03312,株式会社ポプラ,1,0,0,0,0,1
2438,E03313,株式会社マックハウス,1,0,0,0,0,1
2439,E03314,株式会社　梅の花,1,0,0,0,0,1
2440,E03315,株式会社　フジ・コーポレーション,1,0,0,0,0,1
2441,E03316,株式会社ユナイテッドアローズ,1,0,0,0,0,1
2442,E03317,株式会社オーエムツーネットワーク,1,0,0,0,0,1
2443,E03318,株式会社ハイデイ日高,1,0,0,0,0,1
2444,E03319,株式会社テイツー,1,0,0,0,0,1
2445,E03320,京都きもの友禅株式会社,1,0,0,0,0,1
2446,E03321,株式会社　コロワイド,1,0,0,0,0,1
2447,E03323,株式会社ピーシーデポコーポレーション,1,0,0,0,0,1
2448,E03324,株式会社うかい,1,0,0,0,0,1
2449,E03325,株式会社さかい,1,0,0,0,0,1
2450,E03326,株式会社サンオータス,1,0,0,0,0,1
2451,E03327,株式会社グローバルダイニング,1,0,0,0,0,1
2452,E03329,株式会社壱番屋,1,0,0,0,0,1
2453,E03330,株式会社星医療酸器,1,0,0,0,0,1
2454,E03331,株式会社ハンズマン,1,0,0,0,0,1
2455,E03332,白銅株式会社,1,0,0,0,0,1
2456,E03333,株式会社シーマ,1,0,0,0,0,1
2457,E03334,株式会社クレックス,1,0,0,0,0,1
2458,E03336,株式会社トップカルチャー,1,0,0,0,0,1
2459,E03340,株式会社ダイイチ,1,0,0,0,0,1
2460,E03342,株式会社ベルパーク,1,0,0,0,0,1
2461,E03343,株式会社ＰＬＡＮＴ,1,0,0,0,0,1
2462,E03344,スギホールディングス株式会社,1,0,0,0,0,1
2463,E03345,株式会社ローソン,1,0,0,0,0,1
2464,E03346,ぷらっとホーム株式会社,1,0,0,0,0,1
2465,E03347,株式会社まんだらけ,1,0,0,0,0,1
2466,E03348,マックスバリュ東北株式会社,1,0,0,0,0,1
2467,E03349,イオン九州株式会社,1,0,0,0,0,1
2468,E03350,株式会社ダイユーエイト,1,0,0,0,0,1
2469,E03351,株式会社Ｋ－ＧＯＬＤインターナショナル,0,0,0,0,0,0
2470,E03352,株式会社サンエー,1,0,0,0,0,1
2471,E03353,株式会社キリン堂,0,0,0,0,0,0
2472,E03355,株式会社　オートウェーブ,1,0,0,0,0,1
2473,E03356,株式会社カワチ薬品,1,0,0,0,0,1
2474,E03358,カネ美食品株式会社,1,0,0,0,0,1
2475,E03359,株式会社ダイナック,1,0,0,0,0,1
2476,E03360,夢みつけ隊株式会社,1,0,0,0,0,1
2477,E03361,株式会社ハードオフコーポレーション,1,0,0,0,0,1
2478,E03362,オーケー株式会社,0,0,0,0,0,0
2479,E03363,アスクル株式会社,1,0,0,0,0,1
2480,E03365,株式会社魚喜,1,0,0,0,0,1
2481,E03366,日本マクドナルドホールディングス株式会社,1,0,0,0,0,1
2482,E03367,株式会社ゲオホールディングス,1,0,0,0,0,1
2483,E03368,株式会社アダストリア,1,0,0,0,0,1
2484,E03369,株式会社ジパング,1,0,0,0,0,1
2485,E03370,株式会社ジーフット,1,0,0,0,0,1
2486,E03372,株式会社シー・ヴイ・エス・ベイエリア,1,0,0,0,0,1
2487,E03374,株式会社ジー・テイスト,1,0,0,0,0,1
2488,E03375,株式会社　くらコーポレーション,1,0,0,0,0,1
2489,E03377,株式会社キャンドゥ,1,0,0,0,0,1
2490,E03379,ぴあ株式会社,1,0,0,0,0,1
2491,E03380,株式会社大戸屋ホールディングス,1,0,0,0,0,1
2492,E03382,スターバックス　コーヒー　ジャパン　株式会社,1,0,0,0,0,1
2493,E03386,株式会社アイケイ,1,0,0,0,0,1
2494,E03387,株式会社パル,1,0,0,0,0,1
2495,E03391,株式会社ワッツ,1,0,0,0,0,1
2496,E03392,株式会社サダマツ,1,0,0,0,0,1
2497,E03393,株式会社スタジオアリス,1,0,0,0,0,1
2498,E03394,株式会社バルス,0,0,0,0,0,0
2499,E03395,株式会社ハローズ,1,0,0,0,0,1
2500,E03396,ビズネット株式会社,0,0,0,0,0,0
2501,E03397,北雄ラッキー株式会社,1,0,0,0,0,1
2502,E03398,株式会社　あみやき亭,1,0,0,0,0,1
2503,E03399,株式会社エディオン,1,0,0,0,0,1
2504,E03400,株式会社フジオフードシステム,1,0,0,0,0,1
2505,E03401,株式会社東葛ホールディングス,1,0,0,0,0,1
2506,E03404,株式会社　三光マーケティングフーズ,1,0,0,0,0,1
2507,E03405,株式会社エフティグループ,1,0,0,0,0,1
2508,E03406,株式会社ひらまつ,1,0,0,0,0,1
2509,E03407,フィールズ株式会社,1,0,0,0,0,1
2510,E03408,株式会社サーラコーポレーション,1,0,0,0,0,1
2511,E03409,株式会社ヴィレッジヴァンガードコーポレーション,1,0,0,0,0,1
2512,E03410,ゲンキー株式会社,1,0,0,0,0,1
2513,E03415,株式会社パレモ,1,0,0,0,0,1
2514,E03416,株式会社コメ兵,1,0,0,0,0,1
2515,E03418,株式会社セリア,1,0,0,0,0,1
2516,E03419,株式会社サッポロドラッグストアー,1,0,0,0,0,1
2517,E03421,株式会社ナフコ,1,0,0,0,0,1
2518,E03422,株式会社カルラ,1,0,0,0,0,1
2519,E03423,大黒天物産株式会社,1,0,0,0,0,1
2520,E03424,株式会社ハニーズ,1,0,0,0,0,1
2521,E03428,株式会社ワイズテーブルコーポレーション,1,0,0,0,0,1
2522,E03429,株式会社アップガレージ,0,0,0,0,0,0
2523,E03430,ブックオフコーポレーション株式会社,1,0,0,0,0,1
2524,E03432,株式会社フライングガーデン,1,0,0,0,0,1
2525,E03433,株式会社メガネスーパー,1,0,0,0,0,1
2526,E03434,株式会社ランシステム,1,0,0,0,0,1
2527,E03435,ケンコーコム株式会社,1,0,0,0,0,1
2528,E03436,東和フードサービス株式会社,1,0,0,0,0,1
2529,E03437,ＢＥＥＮＯＳ株式会社,1,0,0,0,0,1
2530,E03438,株式会社雑貨屋ブルドッグ,1,0,0,0,0,1
2531,E03439,株式会社あさひ,1,0,0,0,0,1
2532,E03443,株式会社メディカル一光,1,0,0,0,0,1
2533,E03444,株式会社ワンダーコーポレーション,1,0,0,0,0,1
2534,E03446,株式会社コスモス薬品,1,0,0,0,0,1
2535,E03447,株式会社バッファロー,1,0,0,0,0,1
2536,E03450,シップヘルスケアホールディングス株式会社,1,0,0,0,0,1
2537,E03451,ワイエスフード株式会社,1,0,0,0,0,1
2538,E03453,株式会社サークルＫサンクス,0,0,0,0,0,0
2539,E03454,株式会社トーエル,1,0,0,0,0,1
2540,E03455,株式会社一六堂,1,0,0,0,0,1
2541,E03456,株式会社フジタコーポレーション,1,0,0,0,0,1
2542,E03457,株式会社関門海,1,0,0,0,0,1
2543,E03459,株式会社オンリー,1,0,0,0,0,1
2544,E03460,株式会社ＺＯＡ,1,0,0,0,0,1
2545,E03461,株式会社薬王堂,1,0,0,0,0,1
2546,E03462,株式会社セブン＆アイ・ホールディングス,1,0,0,0,0,1
2547,E03463,株式会社サマンサタバサジャパンリミテッド,1,0,0,0,0,1
2548,E03464,株式会社ツルハホールディングス,1,0,0,0,0,1
2549,E03465,株式会社パシフィックネット,1,0,0,0,0,1
2550,E03466,株式会社レデイ薬局,0,0,0,0,0,0
2551,E03467,株式会社フェリシモ,1,0,0,0,0,1
2552,E03468,株式会社トリドール,1,0,0,0,0,1
2553,E03469,株式会社クスリのアオキ,1,0,0,0,0,1
2554,E03470,株式会社丸千代山岡家,1,0,0,0,0,1
2555,E03471,株式会社ジェイアイエヌ,1,0,0,0,0,1
2556,E03472,アプライド株式会社,1,0,0,0,0,1
2557,E03473,株式会社ハブ,1,0,0,0,0,1
2558,E03474,株式会社ゴルフ・ドゥ,1,0,0,0,0,1
2559,E03475,株式会社アルペン,1,0,0,0,0,1
2560,E03476,クオール株式会社,1,0,0,0,0,1
2561,E03478,株式会社ペッパーフードサービス,1,0,0,0,0,1
2562,E03480,株式会社イトーヨーカ堂,0,0,0,0,0,0
2563,E03481,株式会社ビックカメラ,1,0,0,0,0,1
2564,E03482,株式会社ＴＲＵＣＫ－ＯＮＥ,1,0,0,0,0,1
2565,E03484,エノテカ株式会社,0,0,0,0,0,0
2566,E03485,株式会社東京一番フーズ,1,0,0,0,0,1
2567,E03486,株式会社ゼットン,1,0,0,0,0,1
2568,E03487,株式会社三洋堂ホールディングス,1,0,0,0,0,1
2569,E03489,ＤＣＭホールディングス株式会社,1,0,0,0,0,1
2570,E03490,株式会社ライフフーズ,1,0,0,0,0,1
2571,E03491,マガシーク株式会社,1,0,0,0,0,1
2572,E03493,株式会社アートネイチャー,1,0,0,0,0,1
2573,E03494,ヒラキ株式会社,1,0,0,0,0,1
2574,E03495,株式会社ジェイグループホールディングス,1,0,0,0,0,1
2575,E03496,株式会社ＷＤＩ,1,0,0,0,0,1
2576,E03497,株式会社ＭｏｎｏｔａＲＯ,1,0,0,0,0,1
2577,E03498,株式会社シーズメン,1,0,0,0,0,1
2578,E03499,株式会社ユニバース,0,0,0,0,0,0
2579,E03500,株式会社ＪＢイレブン,1,0,0,0,0,1
2580,E03501,ミネルヴァ・ホールディングス株式会社,0,0,0,0,0,0
2581,E03505,ホリイフードサービス株式会社,1,0,0,0,0,1
2582,E03506,株式会社ストリーム,1,0,0,0,0,1
2583,E03507,株式会社銚子丸,1,0,0,0,0,1
2584,E03508,株式会社　アスラポート・ダイニング,1,0,0,0,0,1
2585,E03509,株式会社ジェーソン,1,0,0,0,0,1
2586,E03512,株式会社きちり,1,0,0,0,0,1
2587,E03513,アークランドサービス株式会社,1,0,0,0,0,1
2588,E03514,株式会社オストジャパングループ,0,0,0,0,0,0
2589,E03515,株式会社すかいらーく,1,0,0,0,0,1
2590,E03516,Ｊ．フロント　リテイリング株式会社,1,0,0,0,0,1
2591,E03517,株式会社ブロンコビリー,1,0,0,0,0,1
2592,E03518,株式会社ドトール・日レスホールディングス,1,0,0,0,0,1
2593,E03519,株式会社マツモトキヨシホールディングス,1,0,0,0,0,1
2594,E03520,株式会社トレジャー・ファクトリー,1,0,0,0,0,1
2595,E03521,株式会社三越伊勢丹ホールディングス,1,0,0,0,0,1
2596,E03522,株式会社ココカラファイン,1,0,0,0,0,1
2597,E03523,株式会社スーパーバリュー,1,0,0,0,0,1
2598,E03524,株式会社オーシャンシステム,1,0,0,0,0,1
2599,E03528,株式会社物語コーポレーション,1,0,0,0,0,1
2600,E03530,株式会社新生銀行,1,0,0,0,0,1
2601,E03531,株式会社あおぞら銀行,1,0,0,0,0,1
2602,E03532,株式会社みずほ銀行,0,0,0,0,0,0
2603,E03533,株式会社三菱東京ＵＦＪ銀行,0,0,0,0,0,0
2604,E03538,株式会社りそな銀行,0,0,0,0,0,0
2605,E03540,株式会社みずほ銀行,0,0,0,0,0,0
2606,E03541,株式会社北海道銀行,0,0,0,0,0,0
2607,E03542,株式会社青森銀行,1,0,0,0,0,1
2608,E03543,株式会社岩手銀行,1,0,0,0,0,1
2609,E03544,株式会社　東北銀行,1,0,0,0,0,1
2610,E03545,株式会社七十七銀行,1,0,0,0,0,1
2611,E03546,株式会社秋田銀行,1,0,0,0,0,1
2612,E03547,株式会社北都銀行,0,0,0,0,0,0
2613,E03548,株式会社　荘内銀行,0,0,0,0,0,0
2614,E03549,株式会社山形銀行,1,0,0,0,0,1
2615,E03550,株式会社東邦銀行,1,0,0,0,0,1
2616,E03551,株式会社　常陽銀行,1,0,0,0,0,1
2617,E03552,株式会社筑波銀行,1,0,0,0,0,1
2618,E03554,株式会社　群馬銀行,1,0,0,0,0,1
2619,E03555,株式会社武蔵野銀行,1,0,0,0,0,1
2620,E03556,株式会社千葉銀行,1,0,0,0,0,1
2621,E03557,株式会社千葉興業銀行,1,0,0,0,0,1
2622,E03558,株式会社東京都民銀行,1,0,0,0,0,1
2623,E03559,株式会社横浜銀行,1,0,0,0,0,1
2624,E03560,株式会社第四銀行,1,0,0,0,0,1
2625,E03561,株式会社　北越銀行,1,0,0,0,0,1
2626,E03562,株式会社　山梨中央銀行,1,0,0,0,0,1
2627,E03563,株式会社八十二銀行,1,0,0,0,0,1
2628,E03564,株式会社　北陸銀行,0,0,0,0,0,0
2629,E03565,株式会社　富山銀行,1,0,0,0,0,1
2630,E03566,株式会社　北國銀行,1,0,0,0,0,1
2631,E03567,株式会社福井銀行,1,0,0,0,0,1
2632,E03568,株式会社　大垣共立銀行,1,0,0,0,0,1
2633,E03569,株式会社十六銀行,1,0,0,0,0,1
2634,E03570,株式会社静岡銀行,1,0,0,0,0,1
2635,E03571,スルガ銀行株式会社,1,0,0,0,0,1
2636,E03572,株式会社清水銀行,1,0,0,0,0,1
2637,E03573,株式会社三重銀行,1,0,0,0,0,1
2638,E03574,株式会社　百五銀行,1,0,0,0,0,1
2639,E03575,株式会社滋賀銀行,1,0,0,0,0,1
2640,E03576,株式会社京都銀行,1,0,0,0,0,1
2641,E03579,株式会社池田泉州銀行,0,0,0,0,0,0
2642,E03580,株式会社南都銀行,1,0,0,0,0,1
2643,E03581,株式会社紀陽銀行,1,0,0,0,0,1
2644,E03582,株式会社　鳥取銀行,1,0,0,0,0,1
2645,E03583,株式会社山陰合同銀行,1,0,0,0,0,1
2646,E03584,株式会社中国銀行,1,0,0,0,0,1
2647,E03585,株式会社広島銀行,1,0,0,0,0,1
2648,E03587,株式会社阿波銀行,1,0,0,0,0,1
2649,E03588,株式会社百十四銀行,1,0,0,0,0,1
2650,E03589,株式会社伊予銀行,1,0,0,0,0,1
2651,E03590,株式会社四国銀行,1,0,0,0,0,1
2652,E03591,株式会社福岡銀行,0,0,0,0,0,0
2653,E03592,株式会社筑邦銀行,1,0,0,0,0,1
2654,E03593,株式会社　十八銀行,1,0,0,0,0,1
2655,E03594,株式会社親和銀行,0,0,0,0,0,0
2656,E03595,株式会社肥後銀行,1,0,0,0,0,1
2657,E03596,株式会社大分銀行,1,0,0,0,0,1
2658,E03597,株式会社宮崎銀行,1,0,0,0,0,1
2659,E03598,株式会社鹿児島銀行,1,0,0,0,0,1
2660,E03599,株式会社佐賀銀行,1,0,0,0,0,1
2661,E03600,株式会社　但馬銀行,0,0,0,0,0,0
2662,E03601,株式会社みちのく銀行,1,0,0,0,0,1
2663,E03602,株式会社琉球銀行,1,0,0,0,0,1
2664,E03603,株式会社沖縄銀行,1,0,0,0,0,1
2665,E03604,株式会社　西日本シティ銀行,1,0,0,0,0,1
2666,E03606,株式会社三菱ＵＦＪフィナンシャル・グループ,1,0,0,0,0,1
2667,E03609,株式会社札幌北洋ホールディングス,0,0,0,0,0,0
2668,E03610,株式会社　りそなホールディングス,1,0,0,0,0,1
2669,E03611,三井住友トラスト・ホールディングス株式会社,1,0,0,0,0,1
2670,E03614,株式会社三井住友フィナンシャルグループ,1,0,0,0,0,1
2671,E03615,株式会社みずほフィナンシャルグループ,1,0,0,0,0,1
2672,E03617,株式会社三井住友銀行,0,0,0,0,0,0
2673,E03618,株式会社ほくほくフィナンシャルグループ,1,0,0,0,0,1
2674,E03619,株式会社東京スター銀行,0,0,0,0,0,0
2675,E03620,株式会社紀陽ホールディングス,0,0,0,0,0,0
2676,E03622,株式会社山口フィナンシャルグループ,1,0,0,0,0,1
2677,E03623,株式会社セブン銀行,1,0,0,0,0,1
2678,E03624,株式会社ふくおかフィナンシャルグループ,1,0,0,0,0,1
2679,E03625,株式会社埼玉りそな銀行,0,0,0,0,0,0
2680,E03626,三菱ＵＦＪ信託銀行株式会社,0,0,0,0,0,0
2681,E03627,三井住友信託銀行株式会社,0,0,0,0,0,0
2682,E03628,みずほ信託銀行株式会社,0,0,0,0,0,0
2683,E03631,中央三井信託銀行株式会社,0,0,0,0,0,0
2684,E03632,株式会社北洋銀行,1,0,0,0,0,1
2685,E03634,株式会社　北日本銀行,1,0,0,0,0,1
2686,E03635,株式会社　仙台銀行,0,0,0,0,0,0
2687,E03636,株式会社きらやか銀行,0,0,0,0,0,0
2688,E03637,株式会社　福島銀行,1,0,0,0,0,1
2689,E03639,株式会社　栃木銀行,1,0,0,0,0,1
2690,E03640,株式会社東和銀行,1,0,0,0,0,1
2691,E03641,株式会社京葉銀行,1,0,0,0,0,1
2692,E03642,株式会社東日本銀行,1,0,0,0,0,1
2693,E03645,株式会社大光銀行,1,0,0,0,0,1
2694,E03646,株式会社　富山第一銀行,1,0,0,0,0,1
2695,E03647,株式会社福邦銀行,0,0,0,0,0,0
2696,E03648,株式会社静岡中央銀行,0,0,0,0,0,0
2697,E03651,株式会社愛知銀行,1,0,0,0,0,1
2698,E03652,株式会社　名古屋銀行,1,0,0,0,0,1
2699,E03653,株式会社中京銀行,1,0,0,0,0,1
2700,E03654,株式会社第三銀行,1,0,0,0,0,1
2701,E03656,株式会社関西アーバン銀行,1,0,0,0,0,1
2702,E03657,株式会社みなと銀行,1,0,0,0,0,1
2703,E03660,株式会社西京銀行,0,0,0,0,0,0
2704,E03661,株式会社徳島銀行,0,0,0,0,0,0
2705,E03662,株式会社香川銀行,0,0,0,0,0,0
2706,E03663,株式会社　愛媛銀行,1,0,0,0,0,1
2707,E03664,株式会社高知銀行,1,0,0,0,0,1
2708,E03666,株式会社福岡中央銀行,1,0,0,0,0,1
2709,E03667,株式会社長崎銀行,0,0,0,0,0,0
2710,E03669,株式会社　宮崎太陽銀行,1,0,0,0,0,1
2711,E03670,株式会社南日本銀行,1,0,0,0,0,1
2712,E03672,株式会社神奈川銀行,0,0,0,0,0,0
2713,E03673,株式会社豊和銀行,1,0,0,0,0,1
2714,E03674,株式会社大東銀行,1,0,0,0,0,1
2715,E03675,株式会社熊本銀行,0,0,0,0,0,0
2716,E03676,株式会社佐賀共栄銀行,0,0,0,0,0,0
2717,E03678,株式会社トマト銀行,1,0,0,0,0,1
2718,E03679,株式会社島根銀行,1,0,0,0,0,1
2719,E03681,株式会社　大正銀行,0,0,0,0,0,0
2720,E03683,株式会社　沖縄海邦銀行,0,0,0,0,0,0
2721,E03684,株式会社長野銀行,1,0,0,0,0,1
2722,E03686,株式会社八千代銀行,1,0,0,0,0,1
2723,E03688,日本証券金融株式会社,1,0,0,0,0,1
2724,E03689,大阪証券金融株式会社,0,0,0,0,0,0
2725,E03690,中部証券金融株式会社,1,0,0,0,0,1
2726,E03691,株式会社日貿信,0,0,0,0,0,0
2727,E03693,アコム株式会社,1,0,0,0,0,1
2728,E03695,日本アジア投資株式会社,1,0,0,0,0,1
2729,E03697,株式会社アプラスフィナンシャル,1,0,0,0,0,1
2730,E03708,ＳＭＢＣコンシューマーファイナンス株式会社,0,0,0,0,0,0
2731,E03710,ＮＩＳグループ株式会社,0,0,0,0,0,0
2732,E03711,財形住宅金融株式会社,0,0,0,0,0,0
2733,E03716,豊商事株式会社,1,0,0,0,0,1
2734,E03717,第一商品株式会社,1,0,0,0,0,1
2735,E03721,アイフル株式会社,1,0,0,0,0,1
2736,E03722,ＲＨインシグノ株式会社,0,0,0,0,0,0
2737,E03723,株式会社小林洋行,1,0,0,0,0,1
2738,E03724,Ｊトラスト株式会社,1,0,0,0,0,1
2739,E03726,株式会社ジャパン・ファイナンシャル・ソリューションズ,0,0,0,0,0,0
2740,E03727,フューチャーベンチャーキャピタル株式会社,1,0,0,0,0,1
2741,E03728,株式会社フジトミ,1,0,0,0,0,1
2742,E03729,信金中央金庫,1,0,0,0,0,1
2743,E03730,株式会社ホンダファイナンス,0,0,0,0,0,0
2744,E03732,株式会社エム・オー・エー基金,0,0,0,0,0,0
2745,E03733,あかつきフィナンシャルグループ株式会社,1,0,0,0,0,1
2746,E03735,ＧＥジャパン・ファンディング株式会社,0,0,0,0,0,0
2747,E03736,株式会社日産フィナンシャルサービス,0,0,0,0,0,0
2748,E03737,ブルーホライゾン債権回収株式会社,0,0,0,0,0,0
2749,E03738,全宅住宅ローン株式会社,0,0,0,0,0,0
2750,E03739,岡藤ホールディングス株式会社,1,0,0,0,0,1
2751,E03740,ＧＦＡ株式会社,1,0,0,0,0,1
2752,E03745,燦キャピタルマネージメント株式会社,1,0,0,0,0,1
2753,E03746,株式会社アサックス,1,0,0,0,0,1
2754,E03747,株式会社マネーパートナーズグループ,1,0,0,0,0,1
2755,E03749,株式会社マネースクウェアＨＤ,1,0,0,0,0,1
2756,E03752,野村ホールディングス株式会社,1,0,0,0,0,1
2757,E03753,株式会社大和証券グループ本社,1,0,0,0,0,1
2758,E03756,株式会社岡三証券グループ,1,0,0,0,0,1
2759,E03757,みずほインベスターズ証券株式会社,0,0,0,0,0,0
2760,E03759,みずほ証券株式会社,0,0,0,0,0,0
2761,E03760,丸三証券株式会社,1,0,0,0,0,1
2762,E03761,むさし証券株式会社,0,0,0,0,0,0
2763,E03762,水戸証券株式会社,1,0,0,0,0,1
2764,E03763,藍澤證券株式会社,1,0,0,0,0,1
2765,E03764,東海東京フィナンシャル・ホールディングス株式会社,1,0,0,0,0,1
2766,E03768,東洋証券株式会社,1,0,0,0,0,1
2767,E03770,澤田ホールディングス株式会社,1,0,0,0,0,1
2768,E03771,三菱ＵＦＪ証券ホールディングス株式会社,0,0,0,0,0,0
2769,E03772,いちよし証券株式会社,1,0,0,0,0,1
2770,E03776,株式会社だいこう証券ビジネス,1,0,0,0,0,1
2771,E03778,リテラ・クレア証券株式会社,0,0,0,0,0,0
2772,E03780,ウツミ屋証券株式会社,0,0,0,0,0,0
2773,E03782,アーク証券株式会社,0,0,0,0,0,0
2774,E03784,極東証券株式会社,1,0,0,0,0,1
2775,E03785,豊証券株式会社,0,0,0,0,0,0
2776,E03786,エース証券株式会社,0,0,0,0,0,0
2777,E03788,岩井コスモホールディングス株式会社,1,0,0,0,0,1
2778,E03789,髙木証券株式会社,1,0,0,0,0,1
2779,E03791,ちばぎん証券株式会社,0,0,0,0,0,0
2780,E03792,丸八証券株式会社,1,0,0,0,0,1
2781,E03793,光世証券株式会社,1,0,0,0,0,1
2782,E03795,あかつき証券株式会社,0,0,0,0,0,0
2783,E03797,ふくおか証券株式会社,0,0,0,0,0,0
2784,E03801,ウェルス・マネジメント株式会社,1,0,0,0,0,1
2785,E03802,みらい證券株式会社,0,0,0,0,0,0
2786,E03803,マネックス証券株式会社,0,0,0,0,0,0
2787,E03805,日本クラウド証券株式会社,0,0,0,0,0,0
2788,E03806,Ｃ＆Ｍ証券株式会社,0,0,0,0,0,0
2789,E03807,松井証券株式会社,1,0,0,0,0,1
2790,E03810,野村證券株式会社,0,0,0,0,0,0
2791,E03813,ひまわりホールディングス株式会社,1,0,0,0,0,1
2792,E03814,株式会社日本取引所グループ,1,0,0,0,0,1
2793,E03815,マネックスグループ株式会社,1,0,0,0,0,1
2794,E03816,株式会社ＳＢＩ証券,0,0,0,0,0,0
2795,E03817,カブドットコム証券株式会社,1,0,0,0,0,1
2796,E03818,スターホールディングス株式会社,1,0,0,0,0,1
2797,E03819,トレイダーズホールディングス株式会社,1,0,0,0,0,1
2798,E03821,インヴァスト証券株式会社,1,0,0,0,0,1
2799,E03822,株式会社エコ・プランニング証券,0,0,0,0,0,0
2800,E03823,東京海上日動火災保険株式会社,0,0,0,0,0,0
2801,E03824,三井住友海上火災保険株式会社,0,0,0,0,0,0
2802,E03826,日本興亜損害保険株式会社,0,0,0,0,0,0
2803,E03827,損害保険ジャパン日本興亜株式会社,0,0,0,0,0,0
2804,E03833,あいおいニッセイ同和損害保険株式会社,0,0,0,0,0,0
2805,E03834,富士火災海上保険株式会社,0,0,0,0,0,0
2806,E03835,朝日火災海上保険株式会社,0,0,0,0,0,0
2807,E03837,西日本建設業保証株式会社,0,0,0,0,0,0
2808,E03838,東日本建設業保証株式会社,0,0,0,0,0,0
2809,E03839,セコム損害保険株式会社,0,0,0,0,0,0
2810,E03841,北海道建設業信用保証株式会社,0,0,0,0,0,0
2811,E03842,トーア再保険株式会社,0,0,0,0,0,0
2812,E03843,ジブラルタ生命保険株式会社,0,0,0,0,0,0
2813,E03845,アクサ生命保険株式会社,0,0,0,0,0,0
2814,E03846,大同生命保険株式会社,0,0,0,0,0,0
2815,E03847,東京海上ホールディングス株式会社,1,0,0,0,0,1
2816,E03848,太陽生命保険株式会社,0,0,0,0,0,0
2817,E03850,共栄火災海上保険株式会社,0,0,0,0,0,0
2818,E03851,株式会社Ｔ＆Ｄホールディングス,1,0,0,0,0,1
2819,E03852,三井生命保険株式会社,0,0,0,0,0,0
2820,E03854,ＭＳ＆ＡＤインシュアランスグループホールディングス株式会社,1,0,0,0,0,1
2821,E03855,三井不動産株式会社,1,0,0,0,0,1
2822,E03856,三菱地所株式会社,1,0,0,0,0,1
