,EDINET Code,Submitter Name,IsRecorded_try0,IsRecorded_try1,IsRecorded_try2,IsRecorded_try3,IsRecorded_try4,IsRecorded
0,E00004,カネコ種苗株式会社,1,0,0,0,0,1
1,E00006,株式会社　サカタのタネ,1,0,0,0,0,1
2,E00007,株式会社雪国まいたけ,1,0,0,0,0,1
3,E00008,ホクト株式会社,1,0,0,0,0,1
4,E00009,株式会社アクシーズ,1,0,0,0,0,1
5,E00010,株式会社ホーブ,1,0,0,0,0,1
6,E00011,住友林業株式会社,1,0,0,0,0,1
7,E00012,株式会社　極洋,1,0,0,0,0,1
8,E00013,株式会社マルハニチロ食品,0,0,0,0,0,0
9,E00014,日本水産株式会社,1,0,0,0,0,1
10,E00015,マルハニチロ株式会社,1,0,0,0,0,1
11,E00017,株式会社ホウスイ,1,0,0,0,0,1
12,E00020,株式会社マルハニチロホールディングス,1,0,0,0,0,1
13,E00021,三菱マテリアル株式会社,1,0,0,0,0,1
14,E00023,住友金属鉱山株式会社,1,0,0,0,0,1
15,E00024,三井金属鉱業株式会社,1,0,0,0,0,1
16,E00026,日本精鉱株式会社,1,0,0,0,0,1
17,E00027,中外鉱業株式会社,1,0,0,0,0,1
18,E00028,ＤＯＷＡホールディングス株式会社,1,0,0,0,0,1
19,E00030,日本コークス工業株式会社,1,0,0,0,0,1
20,E00031,住石マテリアルズ株式会社,0,0,0,0,0,0
21,E00032,古河機械金属株式会社,1,0,0,0,0,1
22,E00033,常磐興産株式会社,1,0,0,0,0,1
23,E00034,太平洋興発株式会社,1,0,0,0,0,1
24,E00035,株式会社ニッチツ,1,0,0,0,0,1
25,E00036,日鉄鉱業株式会社,1,0,0,0,0,1
26,E00037,三井松島産業株式会社,1,0,0,0,0,1
27,E00040,関東天然瓦斯開発株式会社,1,0,0,0,0,1
28,E00041,石油資源開発株式会社,1,0,0,0,0,1
29,E00043,国際石油開発帝石株式会社,1,0,0,0,0,1
30,E00045,大室温泉株式会社,0,0,0,0,0,0
31,E00048,大和ハウス工業株式会社,1,0,0,0,0,1
32,E00049,株式会社ＮＩＰＰＯ,1,0,0,0,0,1
33,E00050,日本コムシス株式会社,0,0,0,0,0,0
34,E00051,前田建設工業株式会社,1,0,0,0,0,1
35,E00052,大成建設株式会社,1,0,0,0,0,1
36,E00053,清水建設株式会社,1,0,0,0,0,1
37,E00055,株式会社大林組,1,0,0,0,0,1
38,E00056,株式会社　熊谷組,1,0,0,0,0,1
39,E00058,鹿島建設株式会社,1,0,0,0,0,1
40,E00059,日本国土開発株式会社,0,0,0,0,0,0
41,E00060,西松建設株式会社,1,0,0,0,0,1
42,E00061,前田道路株式会社,1,0,0,0,0,1
43,E00063,飛島建設株式会社,1,0,0,0,0,1
44,E00064,松井建設株式会社,1,0,0,0,0,1
45,E00065,鉄建建設株式会社,1,0,0,0,0,1
46,E00066,東亜道路工業株式会社,1,0,0,0,0,1
47,E00067,日本道路株式会社,1,0,0,0,0,1
48,E00069,株式会社錢高組,1,0,0,0,0,1
49,E00070,日鉄住金テックスエンジ株式会社,1,0,0,0,0,1
50,E00073,株式会社中電工,1,0,0,0,0,1
51,E00074,株式会社関電工,1,0,0,0,0,1
52,E00075,株式会社きんでん,1,0,0,0,0,1
53,E00076,株式会社トーエネック,1,0,0,0,0,1
54,E00078,日本工営株式会社,1,0,0,0,0,1
55,E00079,徳倉建設株式会社,1,0,0,0,0,1
56,E00080,東亜建設工業株式会社,1,0,0,0,0,1
57,E00081,若築建設株式会社,1,0,0,0,0,1
58,E00082,東洋建設株式会社,1,0,0,0,0,1
59,E00083,株式会社奥村組,1,0,0,0,0,1
60,E00085,三井住友建設株式会社,1,0,0,0,0,1
61,E00086,五洋建設株式会社,1,0,0,0,0,1
62,E00088,安藤建設株式会社,0,0,0,0,0,0
63,E00090,株式会社　長谷工コーポレーション,1,0,0,0,0,1
64,E00091,中央ビルト工業株式会社,1,0,0,0,0,1
65,E00092,株式会社東京エネシス,1,0,0,0,0,1
66,E00093,大末建設株式会社,1,0,0,0,0,1
67,E00094,株式会社協和エクシオ,1,0,0,0,0,1
68,E00095,大豊建設株式会社,1,0,0,0,0,1
69,E00097,株式会社不動テトラ,1,0,0,0,0,1
70,E00098,ライト工業株式会社,1,0,0,0,0,1
71,E00099,鈴縫工業株式会社,1,0,0,0,0,1
72,E00101,サンユー建設株式会社,1,0,0,0,0,1
73,E00105,株式会社ナカノフドー建設,1,0,0,0,0,1
74,E00107,三機工業株式会社,1,0,0,0,0,1
75,E00109,三晃金属工業株式会社,1,0,0,0,0,1
76,E00111,大和小田急建設株式会社,1,0,0,0,0,1
77,E00112,東鉄工業株式会社,1,0,0,0,0,1
78,E00113,太平電業株式会社,1,0,0,0,0,1
79,E00114,住友電設株式会社,1,0,0,0,0,1
80,E00115,日本電設工業株式会社,1,0,0,0,0,1
81,E00116,技研興業株式会社,1,0,0,0,0,1
82,E00117,株式会社イチケン,1,0,0,0,0,1
83,E00118,南海辰村建設株式会社,1,0,0,0,0,1
84,E00119,中外炉工業株式会社,1,0,0,0,0,1
85,E00120,株式会社淺沼組,1,0,0,0,0,1
86,E00121,佐田建設株式会社,1,0,0,0,0,1
87,E00124,和興エンジニアリング株式会社,0,0,0,0,0,0
88,E00127,日本電通株式会社,1,0,0,0,0,1
89,E00129,ＮＤＳ株式会社,1,0,0,0,0,1
90,E00130,株式会社　森組,1,0,0,0,0,1
91,E00133,金下建設株式会社,1,0,0,0,0,1
92,E00135,新生テクノス株式会社,0,0,0,0,0,0
93,E00137,株式会社ユアテック,1,0,0,0,0,1
94,E00138,株式会社ヤマト,1,0,0,0,0,1
95,E00142,日特建設株式会社,1,0,0,0,0,1
96,E00143,積水ハウス株式会社,1,0,0,0,0,1
97,E00144,松尾建設株式会社,0,0,0,0,0,0
98,E00146,株式会社九電工,1,0,0,0,0,1
99,E00147,戸田建設株式会社,1,0,0,0,0,1
100,E00148,矢作建設工業株式会社,1,0,0,0,0,1
101,E00149,高砂熱学工業株式会社,1,0,0,0,0,1
102,E00153,株式会社朝日工業社,1,0,0,0,0,1
103,E00156,大林道路株式会社,1,0,0,0,0,1
104,E00157,都築電気株式会社,1,0,0,0,0,1
105,E00161,明星工業株式会社,1,0,0,0,0,1
106,E00165,株式会社ＲＩＳＥ,1,0,0,0,0,1
107,E00167,株式会社佐藤渡辺,1,0,0,0,0,1
108,E00168,日比谷総合設備株式会社,1,0,0,0,0,1
109,E00169,株式会社竹中工務店,0,0,0,0,0,0
110,E00170,株式会社ヤマダ・エスバイエルホーム,1,0,0,0,0,1
111,E00173,株式会社サンテック,1,0,0,0,0,1
112,E00174,青木あすなろ建設株式会社,1,0,0,0,0,1
113,E00175,北野建設株式会社,1,0,0,0,0,1
114,E00176,世紀東急工業株式会社,1,0,0,0,0,1
115,E00177,池野通建株式会社,0,0,0,0,0,0
116,E00178,日成ビルド工業株式会社,1,0,0,0,0,1
117,E00179,株式会社植木組,1,0,0,0,0,1
118,E00181,株式会社四電工,1,0,0,0,0,1
119,E00182,神田通信機株式会社,1,0,0,0,0,1
120,E00183,株式会社大気社,1,0,0,0,0,1
121,E00184,西部電気工業株式会社,1,0,0,0,0,1
122,E00185,日本リーテック株式会社,1,0,0,0,0,1
123,E00186,アタカ大機株式会社,0,0,0,0,0,0
124,E00187,日建工学株式会社,1,0,0,0,0,1
125,E00189,株式会社協和日成,1,0,0,0,0,1
126,E00191,シーキューブ株式会社,1,0,0,0,0,1
127,E00193,株式会社ＴＴＫ,1,0,0,0,0,1
128,E00194,ダイダン株式会社,1,0,0,0,0,1
129,E00196,株式会社福田組,1,0,0,0,0,1
130,E00197,株式会社日本ハウスホールディングス,1,0,0,0,0,1
131,E00198,株式会社ＳＹＳＫＥＮ,1,0,0,0,0,1
132,E00199,株式会社ミライト・テクノロジーズ,0,0,0,0,0,0
133,E00200,東芝プラントシステム株式会社,1,0,0,0,0,1
134,E00201,名工建設株式会社,1,0,0,0,0,1
135,E00202,三信建設工業株式会社,1,0,0,0,0,1
136,E00203,大和電設工業株式会社,0,0,0,0,0,0
137,E00204,日本基礎技術株式会社,1,0,0,0,0,1
138,E00207,北陸電気工事株式会社,1,0,0,0,0,1
139,E00208,株式会社丹青社,1,0,0,0,0,1
140,E00209,株式会社　高田工業所,1,0,0,0,0,1
141,E00210,ＮＥＣネッツエスアイ株式会社,1,0,0,0,0,1
142,E00211,株式会社ソルコム,1,0,0,0,0,1
143,E00213,北陸電話工事株式会社,1,0,0,0,0,1
144,E00214,青木マリーン株式会社,0,0,0,0,0,0
145,E00217,カブトデコム株式会社,0,0,0,0,0,0
146,E00218,大東建託株式会社,1,0,0,0,0,1
147,E00221,新日本建設株式会社,1,0,0,0,0,1
148,E00222,高橋カーテンウォール工業株式会社,1,0,0,0,0,1
149,E00225,株式会社テクノ菱和,1,0,0,0,0,1
150,E00226,株式会社スルガコーポレーション,0,0,0,0,0,0
151,E00227,新日本空調株式会社,1,0,0,0,0,1
152,E00231,株式会社細田工務店,1,0,0,0,0,1
153,E00232,株式会社テノックス,1,0,0,0,0,1
154,E00233,大成温調株式会社,1,0,0,0,0,1
155,E00235,三井ホーム株式会社,1,0,0,0,0,1
156,E00238,株式会社　富士ピー・エス,1,0,0,0,0,1
157,E00239,株式会社大盛工業,1,0,0,0,0,1
158,E00240,株式会社土屋ホールディングス,1,0,0,0,0,1
159,E00242,田辺工業株式会社,1,0,0,0,0,1
160,E00246,暁飯島工業株式会社,1,0,0,0,0,1
161,E00248,サイタホールディングス株式会社,1,0,0,0,0,1
162,E00250,第一建設工業株式会社,1,0,0,0,0,1
163,E00251,株式会社　守谷商会,1,0,0,0,0,1
164,E00252,東邦電気工業株式会社,0,0,0,0,0,0
165,E00253,株式会社藤木工務店,0,0,0,0,0,0
166,E00254,株式会社マサル,1,0,0,0,0,1
167,E00255,株式会社大本組,1,0,0,0,0,1
168,E00258,山加電業株式会社,1,0,0,0,0,1
169,E00259,株式会社三東工業社,1,0,0,0,0,1
170,E00260,株式会社ナカボーテック,1,0,0,0,0,1
171,E00263,株式会社アジアゲートホ－ルディングス（旧会社名　株式会社Ａ．Ｃホールディングス）,1,0,0,0,0,1
172,E00264,大鉄工業株式会社,0,0,0,0,0,0
173,E00265,東光電気工事株式会社,0,0,0,0,0,0
174,E00267,常磐開発株式会社,1,0,0,0,0,1
175,E00268,株式会社　ヤマウラ,1,0,0,0,0,1
176,E00271,川崎設備工業株式会社,1,0,0,0,0,1
177,E00272,三井住建道路株式会社,1,0,0,0,0,1
178,E00273,富士古河Ｅ＆Ｃ株式会社,1,0,0,0,0,1
179,E00276,日本乾溜工業株式会社,1,0,0,0,0,1
180,E00277,藤田エンジニアリング株式会社,1,0,0,0,0,1
181,E00279,株式会社ソネック,1,0,0,0,0,1
182,E00281,東建コーポレーション株式会社,1,0,0,0,0,1
183,E00282,工藤建設株式会社,1,0,0,0,0,1
184,E00285,株式会社髙松コンストラクショングループ,1,0,0,0,0,1
185,E00287,太洋基礎工業株式会社,1,0,0,0,0,1
186,E00288,クレアホールディングス株式会社,1,0,0,0,0,1
187,E00299,コーアツ工業株式会社,1,0,0,0,0,1
188,E00302,シード平和株式会社,1,0,0,0,0,1
189,E00303,三井金属エンジニアリング株式会社,1,0,0,0,0,1
190,E00304,株式会社　オーテック,1,0,0,0,0,1
191,E00306,株式会社北弘電社,1,0,0,0,0,1
192,E00308,麻生フオームクリート株式会社,1,0,0,0,0,1
193,E00309,ミサワホーム中国株式会社,1,0,0,0,0,1
194,E00310,三光ソフランホールディングス株式会社,0,0,0,0,0,0
195,E00311,株式会社サンヨーハウジング名古屋,1,0,0,0,0,1
196,E00312,株式会社ビーアールホールディングス,1,0,0,0,0,1
197,E00313,日本電技株式会社,1,0,0,0,0,1
198,E00314,株式会社フジタ,0,0,0,0,0,0
199,E00315,美樹工業株式会社,1,0,0,0,0,1
200,E00316,東急建設株式会社,1,0,0,0,0,1
201,E00317,株式会社安藤・間,1,0,0,0,0,1
202,E00318,ミサワホーム株式会社,1,0,0,0,0,1
203,E00320,第一カッター興業株式会社,1,0,0,0,0,1
204,E00322,コムシスホールディングス株式会社,1,0,0,0,0,1
205,E00323,株式会社エムビーエス,1,0,0,0,0,1
206,E00325,株式会社桧家ホールディングス,1,0,0,0,0,1
207,E00327,株式会社ウエストホールディングス,1,0,0,0,0,1
208,E00328,東京鋪装工業株式会社,0,0,0,0,0,0
209,E00329,ショーボンドホールディングス株式会社,1,0,0,0,0,1
210,E00331,森永乳業株式会社,1,0,0,0,0,1
211,E00332,株式会社明治,0,0,0,0,0,0
212,E00334,日本ハム株式会社,1,0,0,0,0,1
213,E00335,プリマハム株式会社,1,0,0,0,0,1
214,E00336,伊藤ハム株式会社,1,0,0,0,0,1
215,E00337,六甲バター株式会社,1,0,0,0,0,1
216,E00339,相模ハム株式会社,0,0,0,0,0,0
217,E00340,米久株式会社,1,0,0,0,0,1
218,E00341,福留ハム株式会社,1,0,0,0,0,1
219,E00342,エスフーズ株式会社,1,0,0,0,0,1
220,E00343,滝沢ハム株式会社,1,0,0,0,0,1
221,E00344,株式会社秋川牧園,1,0,0,0,0,1
222,E00345,日本製粉株式会社,1,0,0,0,0,1
223,E00346,株式会社日清製粉グループ本社,1,0,0,0,0,1
224,E00347,日東富士製粉株式会社,1,0,0,0,0,1
225,E00348,昭和産業株式会社,1,0,0,0,0,1
226,E00350,東福製粉株式会社,1,0,0,0,0,1
227,E00351,鳥越製粉株式会社,1,0,0,0,0,1
228,E00352,株式会社増田製粉所,1,0,0,0,0,1
229,E00354,東洋精糖株式会社,1,0,0,0,0,1
230,E00355,日本甜菜製糖株式会社,1,0,0,0,0,1
231,E00356,三井製糖株式会社,1,0,0,0,0,1
232,E00357,新光製糖株式会社,0,0,0,0,0,0
233,E00358,日新製糖株式会社,0,0,0,0,0,0
234,E00360,フジ日本精糖株式会社,1,0,0,0,0,1
235,E00361,塩水港精糖株式会社,1,0,0,0,0,1
236,E00362,新中糖産業株式会社,0,0,0,0,0,0
237,E00365,北部製糖株式会社,0,0,0,0,0,0
238,E00366,株式会社　りゅうとう,0,0,0,0,0,0
239,E00367,久米島製糖株式会社,0,0,0,0,0,0
240,E00368,石垣島製糖株式会社,0,0,0,0,0,0
241,E00369,森永製菓株式会社,1,0,0,0,0,1
242,E00371,井村屋グループ株式会社,1,0,0,0,0,1
243,E00372,株式会社中村屋,1,0,0,0,0,1
244,E00373,江崎グリコ株式会社,1,0,0,0,0,1
245,E00374,株式会社不二家,1,0,0,0,0,1
246,E00375,山崎製パン株式会社,1,0,0,0,0,1
247,E00376,名糖産業株式会社,1,0,0,0,0,1
248,E00377,第一屋製パン株式会社,1,0,0,0,0,1
249,E00378,カンロ株式会社,1,0,0,0,0,1
250,E00379,株式会社駿河屋,0,0,0,0,0,0
251,E00380,株式会社ブルボン,1,0,0,0,0,1
252,E00381,モロゾフ株式会社,1,0,0,0,0,1
253,E00382,日糧製パン株式会社,1,0,0,0,0,1
254,E00384,フジパングループ本社株式会社,0,0,0,0,0,0
255,E00385,亀田製菓株式会社,1,0,0,0,0,1
256,E00386,岩塚製菓株式会社,1,0,0,0,0,1
257,E00387,寿スピリッツ株式会社,1,0,0,0,0,1
258,E00388,株式会社コモ,1,0,0,0,0,1
259,E00389,株式会社フレンテ,1,0,0,0,0,1
260,E00390,２１ＬＡＤＹ株式会社,1,0,0,0,0,1
261,E00392,株式会社シベール,1,0,0,0,0,1
262,E00393,サッポロホールディングス株式会社,1,0,0,0,0,1
263,E00394,アサヒグループホールディングス株式会社,1,0,0,0,0,1
264,E00395,キリンホールディングス株式会社,1,0,0,0,0,1
265,E00396,宝ホールディングス株式会社,1,0,0,0,0,1
266,E00397,オエノンホールディングス株式会社,1,0,0,0,0,1
267,E00399,ジャパン・フード＆リカー・アライアンス株式会社,1,0,0,0,0,1
268,E00400,養命酒製造株式会社,1,0,0,0,0,1
269,E00403,日本清酒株式会社,0,0,0,0,0,0
270,E00405,モンデ酒造株式会社,0,0,0,0,0,0
271,E00406,株式会社ヤクルト本社,1,0,0,0,0,1
272,E00408,北海道コカ・コーラボトリング株式会社,1,0,0,0,0,1
273,E00409,三国コカ・コーラボトリング株式会社,0,0,0,0,0,0
274,E00410,オリオンビール株式会社,0,0,0,0,0,0
275,E00414,株式会社伊藤園,1,0,0,0,0,1
276,E00417,コカ・コーラウエスト株式会社,1,0,0,0,0,1
277,E00421,ジャパンフーズ株式会社,1,0,0,0,0,1
278,E00422,マルサンアイ株式会社,1,0,0,0,0,1
279,E00423,コカ・コーライーストジャパン株式会社,1,0,0,0,0,1
280,E00424,ダイドードリンコ株式会社,1,0,0,0,0,1
281,E00425,南九州コカ・コーラボトリング株式会社,0,0,0,0,0,0
282,E00428,日清オイリオグループ株式会社,1,0,0,0,0,1
283,E00430,ボーソー油脂株式会社,1,0,0,0,0,1
284,E00431,不二製油グループ本社株式会社,1,0,0,0,0,1
285,E00432,攝津製油株式会社,1,0,0,0,0,1
286,E00433,かどや製油株式会社,1,0,0,0,0,1
287,E00434,株式会社Ｊ－オイルミルズ,1,0,0,0,0,1
288,E00435,キッコーマン株式会社,1,0,0,0,0,1
289,E00436,味の素株式会社,1,0,0,0,0,1
290,E00437,ヒゲタ醤油株式会社,0,0,0,0,0,0
291,E00438,協同飼料株式会社,1,0,0,0,0,1
292,E00439,中部飼料株式会社,1,0,0,0,0,1
293,E00440,日本配合飼料株式会社,1,0,0,0,0,1
294,E00442,日本食品化工株式会社,1,0,0,0,0,1
295,E00443,林兼産業株式会社,1,0,0,0,0,1
296,E00444,カゴメ株式会社,1,0,0,0,0,1
297,E00445,三井農林株式会社,0,0,0,0,0,0
298,E00446,株式会社ニチレイ,1,0,0,0,0,1
299,E00447,株式会社　セイヒョー,1,0,0,0,0,1
300,E00448,群栄化学工業株式会社,1,0,0,0,0,1
301,E00451,ローマイヤ株式会社,0,0,0,0,0,0
302,E00452,ヱスビー食品株式会社,1,0,0,0,0,1
303,E00453,石井食品株式会社,1,0,0,0,0,1
304,E00454,日和産業株式会社,1,0,0,0,0,1
305,E00456,ユアサ・フナショク株式会社,1,0,0,0,0,1
306,E00457,日清食品ホールディングス株式会社,1,0,0,0,0,1
307,E00458,丸大食品株式会社,1,0,0,0,0,1
308,E00459,ソントン食品工業株式会社,0,0,0,0,0,0
309,E00461,東洋水産株式会社,1,0,0,0,0,1
310,E00462,ハウス食品グループ本社株式会社,1,0,0,0,0,1
311,E00464,キユーピー株式会社,1,0,0,0,0,1
312,E00465,ユタカフーズ株式会社,1,0,0,0,0,1
313,E00466,ブルドックソース株式会社,1,0,0,0,0,1
314,E00469,株式会社永谷園ホールディングス,1,0,0,0,0,1
315,E00470,テーブルマーク株式会社,0,0,0,0,0,0
316,E00471,石垣食品株式会社,1,0,0,0,0,1
317,E00472,太陽化学株式会社,1,0,0,0,0,1
318,E00473,シノブフーズ株式会社,1,0,0,0,0,1
319,E00474,Ｂ－Ｒ　サーティワン　アイスクリーム株式会社,1,0,0,0,0,1
320,E00475,焼津水産化学工業株式会社,1,0,0,0,0,1
321,E00476,一正蒲鉾株式会社,1,0,0,0,0,1
322,E00477,オーケー食品工業株式会社,1,0,0,0,0,1
323,E00478,和弘食品株式会社,1,0,0,0,0,1
324,E00479,株式会社ホッコク,0,0,0,0,0,0
325,E00480,株式会社あじかん,1,0,0,0,0,1
326,E00481,フジッコ株式会社,1,0,0,0,0,1
327,E00482,株式会社ロック・フィールド,1,0,0,0,0,1
328,E00484,佐藤食品工業株式会社,1,0,0,0,0,1
329,E00485,ジャパンローヤルゼリー株式会社,0,0,0,0,0,0
330,E00486,アリアケジャパン株式会社,1,0,0,0,0,1
331,E00487,旭松食品株式会社,1,0,0,0,0,1
332,E00488,株式会社ジェーシー・コムサ,1,0,0,0,0,1
333,E00489,株式会社鐘崎,0,0,0,0,0,0
334,E00491,キーコーヒー株式会社,1,0,0,0,0,1
335,E00492,日本たばこ産業株式会社,1,0,0,0,0,1
336,E00493,ケンコーマヨネーズ株式会社,1,0,0,0,0,1
337,E00494,仙波糖化工業株式会社,1,0,0,0,0,1
338,E00495,株式会社大森屋,1,0,0,0,0,1
339,E00496,わらべや日洋株式会社,1,0,0,0,0,1
340,E00497,株式会社　マルタイ,1,0,0,0,0,1
341,E00498,日東ベスト株式会社,1,0,0,0,0,1
342,E00501,株式会社ダイショー,1,0,0,0,0,1
343,E00502,株式会社ヒガシマル,1,0,0,0,0,1
344,E00503,アヲハタ株式会社,1,0,0,0,0,1
345,E00505,株式会社ユニカフェ,1,0,0,0,0,1
346,E00506,株式会社なとり,1,0,0,0,0,1
347,E00507,株式会社ギャバン,1,0,0,0,0,1
348,E00508,はごろもフーズ株式会社,1,0,0,0,0,1
349,E00510,佐藤食品工業株式会社,1,0,0,0,0,1
350,E00511,イフジ産業株式会社,1,0,0,0,0,1
351,E00512,株式会社ピックルスコーポレーション,1,0,0,0,0,1
352,E00513,株式会社ピエトロ,1,0,0,0,0,1
353,E00514,エバラ食品工業株式会社,1,0,0,0,0,1
354,E00515,株式会社　篠崎屋,1,0,0,0,0,1
355,E00518,健康コーポレーション株式会社,1,0,0,0,0,1
356,E00520,グンゼ株式会社,1,0,0,0,0,1
357,E00521,価値開発株式会社,1,0,0,0,0,1
358,E00523,ヒューリック株式会社,1,0,0,0,0,1
359,E00524,片倉工業株式会社,1,0,0,0,0,1
360,E00525,東洋紡株式会社,1,0,0,0,0,1
361,E00527,ユニチカ株式会社,1,0,0,0,0,1
362,E00528,倉敷紡績株式会社,1,0,0,0,0,1
363,E00529,ダイワボウホールディングス株式会社,1,0,0,0,0,1
364,E00530,シキボウ株式会社,1,0,0,0,0,1
365,E00531,オーミケンシ株式会社,1,0,0,0,0,1
366,E00532,株式会社プロジェ・ホールディングス,0,0,0,0,0,0
367,E00534,サイボー株式会社,1,0,0,0,0,1
368,E00536,新内外綿株式会社,1,0,0,0,0,1
369,E00540,トヨタ紡織株式会社,1,0,0,0,0,1
370,E00541,Ｏａｋキャピタル株式会社,1,0,0,0,0,1
371,E00542,日東紡績株式会社,1,0,0,0,0,1
372,E00543,富士紡ホールディングス株式会社,1,0,0,0,0,1
373,E00544,日清紡ホールディングス株式会社,1,0,0,0,0,1
374,E00545,マーチャント・バンカーズ株式会社,1,0,0,0,0,1
375,E00546,寺田紡績株式会社,0,0,0,0,0,0
376,E00547,大東紡織株式会社,1,0,0,0,0,1
377,E00550,株式会社ダイドーリミテッド,1,0,0,0,0,1
378,E00551,カネヨウ株式会社,1,0,0,0,0,1
379,E00552,日本毛織株式会社,1,0,0,0,0,1
380,E00555,太陽毛絲紡績株式会社,0,0,0,0,0,0
381,E00556,株式会社トーア紡コーポレーション,1,0,0,0,0,1
382,E00558,日本製麻株式会社,1,0,0,0,0,1
383,E00559,帝国繊維株式会社,1,0,0,0,0,1
384,E00560,株式会社オートリ,0,0,0,0,0,0
385,E00562,セーレン株式会社,1,0,0,0,0,1
386,E00563,東海染工株式会社,1,0,0,0,0,1
387,E00565,サカイオーベックス株式会社,1,0,0,0,0,1
388,E00566,北日本紡績株式会社,1,0,0,0,0,1
389,E00567,アツギ株式会社,1,0,0,0,0,1
390,E00568,株式会社プロスペクト,1,0,0,0,0,1
391,E00569,株式会社ソトー,1,0,0,0,0,1
392,E00570,ニチモウ株式会社,1,0,0,0,0,1
393,E00571,株式会社ナイガイ,1,0,0,0,0,1
394,E00572,イチカワ株式会社,1,0,0,0,0,1
395,E00573,日本フエルト株式会社,1,0,0,0,0,1
396,E00574,住江織物株式会社,1,0,0,0,0,1
397,E00575,株式会社川島織物セルコン,0,0,0,0,0,0
398,E00576,エコナックホールディングス株式会社,1,0,0,0,0,1
399,E00577,芦森工業株式会社,1,0,0,0,0,1
400,E00578,日東製網株式会社,1,0,0,0,0,1
401,E00584,オーベクス株式会社,1,0,0,0,0,1
402,E00585,株式会社バナーズ,1,0,0,0,0,1
403,E00590,株式会社ワコールホールディングス,1,0,0,0,0,1
404,E00591,小松精練株式会社,1,0,0,0,0,1
405,E00593,株式会社三陽商会,1,0,0,0,0,1
406,E00594,日本バイリーン株式会社,1,0,0,0,0,1
407,E00596,倉庫精練株式会社,1,0,0,0,0,1
408,E00597,グローバルアジアホールディングス株式会社,1,0,0,0,0,1
409,E00598,岐セン株式会社,0,0,0,0,0,0
410,E00600,ヤマトインターナショナル株式会社,1,0,0,0,0,1
411,E00601,株式会社デサント,1,0,0,0,0,1
412,E00603,株式会社ゴールドウイン,1,0,0,0,0,1
413,E00604,株式会社ルック,1,0,0,0,0,1
414,E00605,株式会社ラピーヌ,1,0,0,0,0,1
415,E00607,株式会社自重堂,1,0,0,0,0,1
416,E00609,マルコ株式会社,1,0,0,0,0,1
417,E00610,株式会社フジックス,1,0,0,0,0,1
418,E00611,株式会社コーコス信岡,0,0,0,0,0,0
419,E00612,株式会社フジコー,1,0,0,0,0,1
420,E00614,川本産業株式会社,1,0,0,0,0,1
421,E00616,株式会社レナウン,1,0,0,0,0,1
422,E00617,株式会社クラウディア,1,0,0,0,0,1
423,E00619,大建工業株式会社,1,0,0,0,0,1
424,E00620,天龍木材株式会社,0,0,0,0,0,0
425,E00621,兼松日産農林株式会社,1,0,0,0,0,1
426,E00623,大日本木材防腐株式会社,1,0,0,0,0,1
427,E00624,パナホーム株式会社,1,0,0,0,0,1
428,E00627,太平株式会社,0,0,0,0,0,0
429,E00628,名古屋木材株式会社,1,0,0,0,0,1
430,E00630,株式会社ウッドワン,1,0,0,0,0,1
431,E00631,永大産業株式会社,1,0,0,0,0,1
432,E00632,ホクシン株式会社,1,0,0,0,0,1
433,E00633,セブン工業株式会社,1,0,0,0,0,1
434,E00635,南海プライウッド株式会社,1,0,0,0,0,1
435,E00636,株式会社ノダ,1,0,0,0,0,1
436,E00637,ハイビック株式会社,0,0,0,0,0,0
437,E00639,株式会社オービス,1,0,0,0,0,1
438,E00640,ニホンフラッシュ株式会社,1,0,0,0,0,1
439,E00642,王子ホールディングス株式会社,1,0,0,0,0,1
440,E00644,三菱製紙株式会社,1,0,0,0,0,1
441,E00645,北越紀州製紙株式会社,1,0,0,0,0,1
442,E00649,中越パルプ工業株式会社,1,0,0,0,0,1
443,E00650,株式会社巴川製紙所,1,0,0,0,0,1
444,E00652,野崎印刷紙業株式会社,1,0,0,0,0,1
445,E00659,レンゴー株式会社,1,0,0,0,0,1
446,E00660,大王製紙株式会社,1,0,0,0,0,1
447,E00664,古林紙工株式会社,1,0,0,0,0,1
448,E00667,株式会社リヒトラブ,1,0,0,0,0,1
449,E00668,ダイナパック株式会社,1,0,0,0,0,1
450,E00669,株式会社トーモク,1,0,0,0,0,1
451,E00670,コクヨ株式会社,1,0,0,0,0,1
452,E00674,ザ・パック株式会社,1,0,0,0,0,1
453,E00675,スーパーバッグ株式会社,1,0,0,0,0,1
454,E00677,大石産業株式会社,1,0,0,0,0,1
455,E00678,ユニ・チャーム株式会社,1,0,0,0,0,1
456,E00679,ナカバヤシ株式会社,1,0,0,0,0,1
457,E00681,中央紙器工業株式会社,1,0,0,0,0,1
458,E00682,大村紙業株式会社,1,0,0,0,0,1
459,E00685,ニッポン高度紙工業株式会社,1,0,0,0,0,1
460,E00686,昭和パックス株式会社,1,0,0,0,0,1
461,E00687,株式会社岡山製紙,1,0,0,0,0,1
462,E00688,株式会社イムラ封筒,1,0,0,0,0,1
463,E00689,株式会社日本製紙グループ本社,0,0,0,0,0,0
464,E00690,ハビックス株式会社,1,0,0,0,0,1
465,E00691,特種東海製紙株式会社,1,0,0,0,0,1
466,E00692,凸版印刷株式会社,1,0,0,0,0,1
467,E00693,大日本印刷株式会社,1,0,0,0,0,1
468,E00694,図書印刷株式会社,1,0,0,0,0,1
469,E00695,共同印刷株式会社,1,0,0,0,0,1
470,E00696,光村印刷株式会社,1,0,0,0,0,1
471,E00697,株式会社西日本新聞社,0,0,0,0,0,0
472,E00698,株式会社神戸新聞社,0,0,0,0,0,0
473,E00699,株式会社東洋経済新報社,0,0,0,0,0,0
474,E00700,学校図書株式会社,0,0,0,0,0,0
475,E00701,株式会社　岩手日報社,0,0,0,0,0,0
476,E00703,日本写真印刷株式会社,1,0,0,0,0,1
477,E00704,三浦印刷株式会社,1,0,0,0,0,1
478,E00705,株式会社ヴィア・ホールディングス,1,0,0,0,0,1
479,E00706,株式会社毎日新聞社,0,0,0,0,0,0
480,E00707,株式会社学研ホールディングス,1,0,0,0,0,1
481,E00708,光ビジネスフォーム株式会社,1,0,0,0,0,1
482,E00709,株式会社文溪堂,1,0,0,0,0,1
483,E00710,宝印刷株式会社,1,0,0,0,0,1
